{"$schema":"https://json-schema.org/draft/2020-12/schema","title":"Markers","type":"object","required":["symbols","risks"],"properties":{"symbols":{"type":"object","additionalProperties":{"type":"string"}},"files_pinned":{"type":"array","items":{"type":"string"}},"core_nodes":{"type":"array","items":{"type":"string"}},"relations":{"type":"array","items":{"type":"object","required":["from","to","type"],"properties":{"from":{"type":"string"},"to":{"type":"string"},"type":{"type":"string"}}}},"risks":{"type":"array","items":{"type":"string"}},"next_entry":{"type":"string"}},"additionalProperties":false}